{"id": "example_mc6_6", "source": "session_plan.pdf", "type": "planner_example", "meso_id": "MC6.6", "input": {"niveau": "intermÃ©diaire", "objectif_macro": "endurance & capacitÃ© cardio", "mÃ©thode": "metcon cardio modÃ©rÃ©", "intensitÃ©": "65â€“75% FCmax", "format": "3â€“4 sÃ©ries de 6â€“8 exos de 45â€“60â€™â€™"}, "output": {"plan_semaine": {"nb_seances": "3", "temps_par_seance": "45 min", "structure_split": "[\"full body cardio\", \"mobilitÃ© + core\", \"cardio/renfo croisÃ©\"]", "formats_dominants": "[\"metcon\", \"circuit\", \"intensitÃ© modÃ©rÃ©e sans pause\"]", "niveau_d_exigence": "\"intermÃ©diaire\"", "volume": "\"stable puis enchaÃ®nÃ©\"", "objectif_technique": "\"tolÃ©rance Ã  lâ€™effort prolongÃ©\""}, "plan_semaine_raw": "plan_semaine:\nnb_seances: 3\ntemps_par_seance: 45 min\nstructure_split: [\"full body cardio\", \"mobilitÃ© + core\", \"cardio/renfo croisÃ©\"]\nformats_dominants: [\"metcon\", \"circuit\", \"intensitÃ© modÃ©rÃ©e sans pause\"]\nniveau_d_exigence: \"intermÃ©diaire\"\nvolume: \"stable puis enchaÃ®nÃ©\"\nobjectif_technique: \"tolÃ©rance Ã  lâ€™effort prolongÃ©\"", "seances_description": "SÃ©ance 1 â€“ Full body cardio intensitÃ© modÃ©rÃ©e\nâ€¢ Intro mentale : focus sur le souffle + rÃ©gularitÃ©\nâ€¢ Ã‰chauffement : mobilitÃ© dynamique + shadow cardio 5â€™\nâ€¢ Bloc principal : 3 circuits de 6 exos polyarticulaires (30â€™â€™ effort /\n20â€™â€™ rÃ©cup)\nâ€¢ Retour au calme : respiration guidÃ©e + Ã©tirement jambes\nâ€¢ Message : â€œBravo pour cette premiÃ¨re Ã©tape, la rÃ©gularitÃ©\nconstruit lâ€™endurance !â€\nğŸŸ§ SÃ©ance 2 â€“ MobilitÃ© + core\nâ€¢ Bloc 1 : mobilitÃ© au sol\nâ€¢ Bloc 2 : gainage dynamique enchaÃ®nÃ©\nâ€¢ Bloc 3 : sÃ©quence respiration diaphragmatique + posture\n(tu modules les blocs selon plan_semaine)\nğŸŸ§ SÃ©ance 3 â€“ Cardio/renfo croisÃ©\nâ€¢ EMOM 10â€™ : squat + push-up + rope invisible\nâ€¢ 3x circuits : gainage + fentes sautÃ©es + triceps dips\nâ€¢ Ã‰tirements bras + respiration calme"}, "rule_text": "ğŸ“„ 3. Exemple concret : MC6.6 â€“ RÃ©sistance cardio\nDonnÃ©es disponibles :\nâ€¢ Niveau : intermÃ©diaire\nâ€¢ Objectif macro : endurance & capacitÃ© cardio\nâ€¢ MÃ©thode : metcon cardio modÃ©rÃ©\nâ€¢ IntensitÃ© : 65â€“75% FCmax\nâ€¢ Format : 3â€“4 sÃ©ries de 6â€“8 exos de 45â€“60â€™â€™\nâ¸»\nâ†’ Plan de semaine dÃ©duit :\nplan_semaine:\nnb_seances: 3\ntemps_par_seance: 45 min\nstructure_split: [\"full body cardio\", \"mobilitÃ© + core\", \"cardio/renfo croisÃ©\"]\nformats_dominants: [\"metcon\", \"circuit\", \"intensitÃ© modÃ©rÃ©e sans pause\"]\nniveau_d_exigence: \"intermÃ©diaire\"\nvolume: \"stable puis enchaÃ®nÃ©\"\nobjectif_technique: \"tolÃ©rance Ã  lâ€™effort prolongÃ©\"\nChaque sÃ©ance = 5 blocs : intro mentale + Ã©chauffement + exos (3â€“6) +\nretour au calme + message\nElle pioche dans la base dâ€™exos ceux compatibles avec :\nâ–  le format (ex : AMRAP, tempo lent, unilatÃ©ralâ€¦)\nâ–  le niveau\nâ–  la zone musculaire\nâ–  le matÃ©riel\nâ¸»"}
