{"id": "example_mc6_6", "source": "session_plan.pdf", "type": "planner_example", "meso_id": "MC6.6", "input": {"niveau": "interm√©diaire", "objectif_macro": "endurance & capacit√© cardio", "m√©thode": "metcon cardio mod√©r√©", "intensit√©": "65‚Äì75% FCmax", "format": "3‚Äì4 s√©ries de 6‚Äì8 exos de 45‚Äì60‚Äô‚Äô"}, "output": {"plan_semaine": {"nb_seances": "3", "temps_par_seance": "45 min", "structure_split": "[\"full body cardio\", \"mobilit√© + core\", \"cardio/renfo crois√©\"]", "formats_dominants": "[\"metcon\", \"circuit\", \"intensit√© mod√©r√©e sans pause\"]", "niveau_d_exigence": "\"interm√©diaire\"", "volume": "\"stable puis encha√Æn√©\"", "objectif_technique": "\"tol√©rance √† l‚Äôeffort prolong√©\""}, "plan_semaine_raw": "plan_semaine:\nnb_seances: 3\ntemps_par_seance: 45 min\nstructure_split: [\"full body cardio\", \"mobilit√© + core\", \"cardio/renfo crois√©\"]\nformats_dominants: [\"metcon\", \"circuit\", \"intensit√© mod√©r√©e sans pause\"]\nniveau_d_exigence: \"interm√©diaire\"\nvolume: \"stable puis encha√Æn√©\"\nobjectif_technique: \"tol√©rance √† l‚Äôeffort prolong√©\"", "seances_description": "S√©ance 1 ‚Äì Full body cardio intensit√© mod√©r√©e\n‚Ä¢ Intro mentale : focus sur le souffle + r√©gularit√©\n‚Ä¢ √âchauffement : mobilit√© dynamique + shadow cardio 5‚Äô\n‚Ä¢ Bloc principal : 3 circuits de 6 exos polyarticulaires (30‚Äô‚Äô effort /\n20‚Äô‚Äô r√©cup)\n‚Ä¢ Retour au calme : respiration guid√©e + √©tirement jambes\n‚Ä¢ Message : ‚ÄúBravo pour cette premi√®re √©tape, la r√©gularit√©\nconstruit l‚Äôendurance !‚Äù\nüüß S√©ance 2 ‚Äì Mobilit√© + core\n‚Ä¢ Bloc 1 : mobilit√© au sol\n‚Ä¢ Bloc 2 : gainage dynamique encha√Æn√©\n‚Ä¢ Bloc 3 : s√©quence respiration diaphragmatique + posture\n(tu modules les blocs selon plan_semaine)\nüüß S√©ance 3 ‚Äì Cardio/renfo crois√©\n‚Ä¢ EMOM 10‚Äô : squat + push-up + rope invisible\n‚Ä¢ 3x circuits : gainage + fentes saut√©es + triceps dips\n‚Ä¢ √âtirements bras + respiration calme"}, "rule_text": "üìÑ 3. Exemple concret : MC6.6 ‚Äì R√©sistance cardio\nDonn√©es disponibles :\n‚Ä¢ Niveau : interm√©diaire\n‚Ä¢ Objectif macro : endurance & capacit√© cardio\n‚Ä¢ M√©thode : metcon cardio mod√©r√©\n‚Ä¢ Intensit√© : 65‚Äì75% FCmax\n‚Ä¢ Format : 3‚Äì4 s√©ries de 6‚Äì8 exos de 45‚Äì60‚Äô‚Äô\n‚∏ª\n‚Üí Plan de semaine d√©duit :\nplan_semaine:\nnb_seances: 3\ntemps_par_seance: 45 min\nstructure_split: [\"full body cardio\", \"mobilit√© + core\", \"cardio/renfo crois√©\"]\nformats_dominants: [\"metcon\", \"circuit\", \"intensit√© mod√©r√©e sans pause\"]\nniveau_d_exigence: \"interm√©diaire\"\nvolume: \"stable puis encha√Æn√©\"\nobjectif_technique: \"tol√©rance √† l‚Äôeffort prolong√©\"\nChaque s√©ance = 5 blocs : intro mentale + √©chauffement + exos (3‚Äì6) +\nretour au calme + message\nElle pioche dans la base d‚Äôexos ceux compatibles avec :\n‚ñ† le format (ex : AMRAP, tempo lent, unilat√©ral‚Ä¶)\n‚ñ† le niveau\n‚ñ† la zone musculaire\n‚ñ† le mat√©riel\n‚∏ª", "structured": {"muscle_groups_required": [], "muscle_groups_optional": [], "exercise_families_allowed": ["metcon", "circuit"], "equipment_required": [], "equipment_optional": [], "intensity_range": "65-75% FCmax", "volume_range": "3-4 s√©ries de 6-8 exos", "rest_range": null, "balance_required": false, "antagonist_pairs": [], "variety_required": true}, "keywords": ["endurance", "capacit√© cardio", "interm√©diaire", "metcon cardio mod√©r√©", "intensit√© mod√©r√©e", "s√©ances", "blocs", "exercices"], "conditions_parsed": {"applies_when": "Niveau interm√©diaire et objectif d'endurance & capacit√© cardio", "exceptions": null}}
