{
  "exercise": "Single Arm Dumbbell Seated Shoulder External Rotation",
  "exercise_en": "Single Arm Dumbbell Seated Shoulder External Rotation",
  "difficulty_level": "Novice",
  "difficulty_level_en": "Novice",
  "target_muscle_group": "Épaules",
  "target_muscle_group_en": "Shoulders",
  "primary_equipment": "Haltère",
  "primary_equipment_en": "Dumbbell",
  "posture": "Assis",
  "posture_en": "Seated",
  "single_or_double_arm": "Un bras",
  "single_or_double_arm_en": "Single Arm",
  "continuous_or_alternating_arms": "Continu",
  "continuous_or_alternating_arms_en": "Continuous",
  "grip": "Proné",
  "grip_en": "Pronated",
  "continuous_or_alternating_legs": "Continu",
  "continuous_or_alternating_legs_en": "Continuous",
  "foot_elevation": "Pas de surélévation",
  "foot_elevation_en": "No Elevation",
  "combination_exercises": "Exercice isolé",
  "combination_exercises_en": "Single Exercise",
  "movement_pattern": "Rotation externe de l'épaule",
  "movement_pattern_en": "Shoulder External Rotation",
  "body_region": "Haut du corps",
  "body_region_en": "Upper Body",
  "force_type": "Tirage",
  "force_type_en": "Pull",
  "mechanics": "Exercice d'isolation",
  "mechanics_en": "Isolation",
  "laterality": "Unilatéral",
  "laterality_en": "Unilateral",
  "primary_exercise_classification": null,
  "text": "L'exercice de rotation externe de l'épaule, connu sous le nom de Single Arm Dumbbell Seated Shoulder External Rotation, est idéal pour les novices souhaitant renforcer leurs épaules. Cet exercice isolé se pratique en position assise, avec un haltère dans une prise pronée, ce qui permet de cibler efficacement les muscles deltoïdes et les rotateurs externes de l'épaule. \n\nPour réaliser cet exercice, asseyez-vous sur un banc, le dos bien droit, et gardez un bras en position de travail, l'autre pouvant reposer sur votre genou. Le mouvement consiste à faire une rotation externe continue de l'épaule, tout en maintenant les pieds à plat sur le sol, sans surélévation. Ce modèle de mouvement unilatéral permet de développer la force de tirage du haut du corps, favorisant une meilleure stabilité et mobilité des épaules. Intégrez cet exercice à votre routine pour améliorer votre posture et prévenir les blessures."
}