{
  "exercise": "Slider Single Arm Kettlebell Bottoms Up Front Rack Contralateral Reverse Lunge",
  "exercise_en": "Slider Single Arm Kettlebell Bottoms Up Front Rack Contralateral Reverse Lunge",
  "difficulty_level": "Intermédiaire",
  "difficulty_level_en": "Intermediate",
  "target_muscle_group": "Quadriceps",
  "target_muscle_group_en": "Quadriceps",
  "primary_equipment": "Glisseurs",
  "primary_equipment_en": "Sliders",
  "posture": "Debout",
  "posture_en": "Standing",
  "single_or_double_arm": "Un bras",
  "single_or_double_arm_en": "Single Arm",
  "continuous_or_alternating_arms": "Continu",
  "continuous_or_alternating_arms_en": "Continuous",
  "grip": "En bas",
  "grip_en": "Bottoms Up",
  "continuous_or_alternating_legs": "Continu",
  "continuous_or_alternating_legs_en": "Continuous",
  "foot_elevation": "Pas de surélévation",
  "foot_elevation_en": "No Elevation",
  "combination_exercises": "Exercice isolé",
  "combination_exercises_en": "Single Exercise",
  "movement_pattern": "Dominant du genou",
  "movement_pattern_en": "Knee Dominant",
  "body_region": "Bas du corps",
  "body_region_en": "Lower Body",
  "force_type": "Poussée",
  "force_type_en": "Push",
  "mechanics": "Exercice composé",
  "mechanics_en": "Compound",
  "laterality": "Contralatéral",
  "laterality_en": "Contralateral",
  "primary_exercise_classification": "Musculation",
  "primary_exercise_classification_en": "Bodybuilding",
  "text": "L'exercice *Slider Single Arm Kettlebell Bottoms Up Front Rack Contralateral Reverse Lunge* est un mouvement de difficulté intermédiaire qui cible principalement les quadriceps. Pour réaliser cet exercice, vous aurez besoin de glisseurs, qui vous permettront d'ajouter une dimension dynamique à votre entraînement. Commencez en position debout, en tenant une kettlebell dans un bras avec une prise en bas, tout en maintenant l'autre bras libre. \n\nLe mouvement consiste en des fentes inversées à jambe contralatérale, ce qui signifie que vous allez reculer avec une jambe opposée à celle qui tient la kettlebell. Ce modèle de mouvement est dominant du genou et constitue un exercice isolé, axé sur le bas du corps. L'élévation des pieds ne nécessite pas de surélévation, et le mouvement des bras doit être continu tout au long de l'exercice. En intégrant cet exercice composé à votre routine de musculation, vous développerez à la fois force de poussée et stabilité."
}