{
  "exercise": "Single Arm Kettlebell Bottoms Up Overhead Alternating Cossack Squat",
  "exercise_en": "Single Arm Kettlebell Bottoms Up Overhead Alternating Cossack Squat",
  "difficulty_level": "Intermédiaire",
  "difficulty_level_en": "Intermediate",
  "target_muscle_group": "Quadriceps",
  "target_muscle_group_en": "Quadriceps",
  "primary_equipment": "Kettlebell",
  "primary_equipment_en": "Kettlebell",
  "posture": "Debout",
  "posture_en": "Standing",
  "single_or_double_arm": "Un bras",
  "single_or_double_arm_en": "Single Arm",
  "continuous_or_alternating_arms": "Continu",
  "continuous_or_alternating_arms_en": "Continuous",
  "grip": "En bas",
  "grip_en": "Bottoms Up",
  "continuous_or_alternating_legs": "Alterné",
  "continuous_or_alternating_legs_en": "Alternating",
  "foot_elevation": "Pas de surélévation",
  "foot_elevation_en": "No Elevation",
  "combination_exercises": "Exercice isolé",
  "combination_exercises_en": "Single Exercise",
  "movement_pattern": "Dominant du genou",
  "movement_pattern_en": "Knee Dominant",
  "body_region": "Bas du corps",
  "body_region_en": "Lower Body",
  "force_type": "Poussée",
  "force_type_en": "Push",
  "mechanics": "Exercice composé",
  "mechanics_en": "Compound",
  "laterality": "Unilatéral",
  "laterality_en": "Unilateral",
  "primary_exercise_classification": "Musculation",
  "primary_exercise_classification_en": "Bodybuilding",
  "text": "Le Single Arm Kettlebell Bottoms Up Overhead Alternating Cossack Squat est un exercice de niveau intermédiaire qui cible principalement les quadriceps tout en intégrant le bas du corps dans une dynamique complexe. Pour réaliser cet exercice, vous aurez besoin d'un kettlebell, que vous tiendrez avec un bras en position \"en bas\". La posture débute debout, avec un bras en extension au-dessus de la tête, ce qui nécessite une bonne stabilité et contrôle. \n\nLe mouvement des bras est continu, vous permettant de maintenir la kettlebell en position tout en effectuant des squats alternés avec les jambes. Cet exercice ne nécessite pas de surélévation des pieds, et se concentre sur un modèle de mouvement dominant du genou, favorisant ainsi la force de poussée. En tant qu'exercice composé et unilatéral, il offre une excellente opportunité de renforcer les muscles du bas du corps tout en améliorant la coordination et l'équilibre. Une excellente addition à votre routine de musculation !"
}