{
  "exercise": "Single Arm Dumbbell Suitcase Contralateral Split Squat",
  "exercise_en": "Single Arm Dumbbell Suitcase Contralateral Split Squat",
  "difficulty_level": "Novice",
  "difficulty_level_en": "Novice",
  "target_muscle_group": "Quadriceps",
  "target_muscle_group_en": "Quadriceps",
  "primary_equipment": "Haltère",
  "primary_equipment_en": "Dumbbell",
  "posture": "Fente",
  "posture_en": "Split Squat",
  "single_or_double_arm": "Un bras",
  "single_or_double_arm_en": "Single Arm",
  "continuous_or_alternating_arms": "Continu",
  "continuous_or_alternating_arms_en": "Continuous",
  "grip": "Neutre",
  "grip_en": "Neutral",
  "continuous_or_alternating_legs": "Continu",
  "continuous_or_alternating_legs_en": "Continuous",
  "foot_elevation": "Pas de surélévation",
  "foot_elevation_en": "No Elevation",
  "combination_exercises": "Exercice isolé",
  "combination_exercises_en": "Single Exercise",
  "movement_pattern": "Dominant du genou",
  "movement_pattern_en": "Knee Dominant",
  "body_region": "Bas du corps",
  "body_region_en": "Lower Body",
  "force_type": "Poussée",
  "force_type_en": "Push",
  "mechanics": "Exercice composé",
  "mechanics_en": "Compound",
  "laterality": "Contralatéral",
  "laterality_en": "Contralateral",
  "primary_exercise_classification": "Musculation",
  "primary_exercise_classification_en": "Bodybuilding",
  "text": "Le Single Arm Dumbbell Suitcase Contralateral Split Squat est un exercice de musculation idéal pour les novices, ciblant principalement les quadriceps. Pour réaliser cet exercice, vous aurez besoin d'un haltère. La posture de départ consiste en une fente, où vous vous tenez debout avec un bras tenant l'haltère à côté de votre corps, en adoptant une prise neutre. Pendant l'exercice, le mouvement des bras est continu, ce qui permet de maintenir l'équilibre tout en effectuant un mouvement de jambes également continu, sans surélever les pieds. Ce mouvement, qui sollicite la force de poussée, est un exercice isolé et se caractérise par un modèle de mouvement dominant du genou. De plus, la latéralité contralatérale de l'exercice contribue à renforcer la stabilité du bas du corps. Intégrez cet exercice à votre routine pour améliorer votre force et votre équilibre."
}