{
  "exercise": "Single Arm Dumbbell Overhead Ipsilateral Split Squat",
  "exercise_en": "Single Arm Dumbbell Overhead Ipsilateral Split Squat",
  "difficulty_level": "Intermédiaire",
  "difficulty_level_en": "Intermediate",
  "target_muscle_group": "Quadriceps",
  "target_muscle_group_en": "Quadriceps",
  "primary_equipment": "Haltère",
  "primary_equipment_en": "Dumbbell",
  "posture": "Fente",
  "posture_en": "Split Squat",
  "single_or_double_arm": "Un bras",
  "single_or_double_arm_en": "Single Arm",
  "continuous_or_alternating_arms": "Continu",
  "continuous_or_alternating_arms_en": "Continuous",
  "grip": "Neutre",
  "grip_en": "Neutral",
  "continuous_or_alternating_legs": "Continu",
  "continuous_or_alternating_legs_en": "Continuous",
  "foot_elevation": "Pas de surélévation",
  "foot_elevation_en": "No Elevation",
  "combination_exercises": "Exercice isolé",
  "combination_exercises_en": "Single Exercise",
  "movement_pattern": "Dominant du genou",
  "movement_pattern_en": "Knee Dominant",
  "body_region": "Bas du corps",
  "body_region_en": "Lower Body",
  "force_type": "Poussée",
  "force_type_en": "Push",
  "mechanics": "Exercice composé",
  "mechanics_en": "Compound",
  "laterality": "Ipsilatéral",
  "laterality_en": "Ipsilateral",
  "primary_exercise_classification": "Musculation",
  "primary_exercise_classification_en": "Bodybuilding",
  "text": "L'exercice de musculation que nous allons aborder est le Single Arm Dumbbell Overhead Ipsilateral Split Squat, un mouvement d'intermédiaire qui cible principalement les quadriceps. Pour réaliser cet exercice, vous aurez besoin d'un haltère. La posture de départ est une fente, où vous vous positionnez sur une jambe tout en maintenant l'haltère au-dessus de votre tête avec un bras, en adoptant une prise neutre.\n\nLe mouvement des bras est continu, ce qui permet de garder une tension constante tout au long de l'exercice, tandis que le mouvement des jambes est également continu, sans surélévation des pieds. Cet exercice isolé, qui se distingue par son modèle de mouvement dominant du genou, sollicite le bas du corps en mettant l'accent sur la force de poussée. En optant pour une approche ipsilatérale, vous renforcez non seulement les muscles ciblés, mais améliorez également votre stabilité et votre équilibre. C'est un excellent choix pour ceux qui cherchent à développer leur force et leur endurance musculaire."
}