{
  "exercise": "Single Arm Kettlebell Front Rack Ipsilateral Split Squat",
  "exercise_en": "Single Arm Kettlebell Front Rack Ipsilateral Split Squat",
  "difficulty_level": "Novice",
  "difficulty_level_en": "Novice",
  "target_muscle_group": "Quadriceps",
  "target_muscle_group_en": "Quadriceps",
  "primary_equipment": "Kettlebell",
  "primary_equipment_en": "Kettlebell",
  "posture": "Fente",
  "posture_en": "Split Squat",
  "single_or_double_arm": "Un bras",
  "single_or_double_arm_en": "Single Arm",
  "continuous_or_alternating_arms": "Continu",
  "continuous_or_alternating_arms_en": "Continuous",
  "grip": "Neutre",
  "grip_en": "Neutral",
  "continuous_or_alternating_legs": "Continu",
  "continuous_or_alternating_legs_en": "Continuous",
  "foot_elevation": "Pas de surélévation",
  "foot_elevation_en": "No Elevation",
  "combination_exercises": "Exercice isolé",
  "combination_exercises_en": "Single Exercise",
  "movement_pattern": "Dominant du genou",
  "movement_pattern_en": "Knee Dominant",
  "body_region": "Bas du corps",
  "body_region_en": "Lower Body",
  "force_type": "Poussée",
  "force_type_en": "Push",
  "mechanics": "Exercice composé",
  "mechanics_en": "Compound",
  "laterality": "Ipsilatéral",
  "laterality_en": "Ipsilateral",
  "primary_exercise_classification": "Musculation",
  "primary_exercise_classification_en": "Bodybuilding",
  "text": "Le Single Arm Kettlebell Front Rack Ipsilateral Split Squat est un excellent exercice pour les novices, ciblant principalement les quadriceps tout en renforçant le bas du corps. Pour réaliser cet exercice, vous aurez besoin d'un kettlebell. Commencez par adopter une posture de fente, en tenant le kettlebell dans un bras avec une prise neutre, ce qui vous permet de maintenir une position stable tout au long du mouvement. \n\nL'exercice se concentre sur un modèle de mouvement dominant du genou, ce qui signifie que vos jambes effectueront un mouvement continu sans surélévation des pieds. En gardant un bras engagé, vous travaillez également votre force de poussée de manière isolée, tout en intégrant une mécanique d'exercice composé. En pratiquant ce mouvement ipsilatéral, vous développez non seulement la force musculaire mais aussi la stabilité et l'équilibre. C'est un excellent ajout à votre routine de musculation pour renforcer vos jambes tout en sollicitant vos muscles de manière efficace."
}