{
  "exercise": "Single Arm Kettlebell Bottoms Up Front Rack Contralateral Split Squat",
  "exercise_en": "Single Arm Kettlebell Bottoms Up Front Rack Contralateral Split Squat",
  "difficulty_level": "Intermédiaire",
  "difficulty_level_en": "Intermediate",
  "target_muscle_group": "Quadriceps",
  "target_muscle_group_en": "Quadriceps",
  "primary_equipment": "Kettlebell",
  "primary_equipment_en": "Kettlebell",
  "posture": "Fente",
  "posture_en": "Split Squat",
  "single_or_double_arm": "Un bras",
  "single_or_double_arm_en": "Single Arm",
  "continuous_or_alternating_arms": "Continu",
  "continuous_or_alternating_arms_en": "Continuous",
  "grip": "En bas",
  "grip_en": "Bottoms Up",
  "continuous_or_alternating_legs": "Continu",
  "continuous_or_alternating_legs_en": "Continuous",
  "foot_elevation": "Pas de surélévation",
  "foot_elevation_en": "No Elevation",
  "combination_exercises": "Exercice isolé",
  "combination_exercises_en": "Single Exercise",
  "movement_pattern": "Dominant du genou",
  "movement_pattern_en": "Knee Dominant",
  "body_region": "Bas du corps",
  "body_region_en": "Lower Body",
  "force_type": "Poussée",
  "force_type_en": "Push",
  "mechanics": "Exercice composé",
  "mechanics_en": "Compound",
  "laterality": "Contralatéral",
  "laterality_en": "Contralateral",
  "primary_exercise_classification": "Musculation",
  "primary_exercise_classification_en": "Bodybuilding",
  "text": "Le Single Arm Kettlebell Bottoms Up Front Rack Contralateral Split Squat est un exercice de musculation de niveau intermédiaire qui cible principalement les quadriceps. Pour réaliser cet exercice, vous aurez besoin d'un kettlebell. Commencez par adopter une posture de fente, en maintenant le kettlebell en position « bottoms up » dans un bras, ce qui nécessite une bonne stabilité et un engagement du core. Le mouvement des bras est continu, avec le kettlebell maintenu en bas, tandis que vous descendez et remontez en contrôlant bien chaque mouvement. Les jambes effectuent un mouvement continu sans surélévation des pieds, ce qui met l'accent sur la force de poussée et le modèle de mouvement dominant du genou. Grâce à la latéralité contralatérale, cet exercice composé sollicite efficacement le bas du corps tout en améliorant votre équilibre et votre coordination."
}