{
  "exercise": "Single Arm Kettlebell Suitcase Contralateral Split Squat",
  "exercise_en": "Single Arm Kettlebell Suitcase Contralateral Split Squat",
  "difficulty_level": "Novice",
  "difficulty_level_en": "Novice",
  "target_muscle_group": "Quadriceps",
  "target_muscle_group_en": "Quadriceps",
  "primary_equipment": "Kettlebell",
  "primary_equipment_en": "Kettlebell",
  "posture": "Fente",
  "posture_en": "Split Squat",
  "single_or_double_arm": "Un bras",
  "single_or_double_arm_en": "Single Arm",
  "continuous_or_alternating_arms": "Continu",
  "continuous_or_alternating_arms_en": "Continuous",
  "grip": "Neutre",
  "grip_en": "Neutral",
  "continuous_or_alternating_legs": "Continu",
  "continuous_or_alternating_legs_en": "Continuous",
  "foot_elevation": "Pas de surélévation",
  "foot_elevation_en": "No Elevation",
  "combination_exercises": "Exercice isolé",
  "combination_exercises_en": "Single Exercise",
  "movement_pattern": "Dominant du genou",
  "movement_pattern_en": "Knee Dominant",
  "body_region": "Bas du corps",
  "body_region_en": "Lower Body",
  "force_type": "Poussée",
  "force_type_en": "Push",
  "mechanics": "Exercice composé",
  "mechanics_en": "Compound",
  "laterality": "Contralatéral",
  "laterality_en": "Contralateral",
  "primary_exercise_classification": "Musculation",
  "primary_exercise_classification_en": "Bodybuilding",
  "text": "Le Single Arm Kettlebell Suitcase Contralateral Split Squat est un exercice de musculation idéal pour les novices qui souhaitent renforcer leurs quadriceps tout en améliorant leur équilibre. Pour réaliser cet exercice, vous aurez besoin d'un kettlebell. Commencez par adopter une posture de fente, en maintenant un bras tendu avec le kettlebell dans une prise neutre, ce qui vous permet de travailler la force de poussée dans le bas du corps. Le mouvement des bras doit être continu, synchronisé avec celui de vos jambes, qui exécute également un mouvement fluide sans surélévation des pieds. Cet exercice isolé, basé sur un modèle de mouvement dominant du genou, fait appel à une mécanique composée et utilise une latéralité contralatérale, ce qui favorise un travail harmonieux et équilibré des muscles. Intégrez-le à votre routine pour un renforcement efficace et ciblé."
}