{
  "exercise": "Single Arm Kettlebell Bottoms Up Overhead Ipsilateral Lateral Lunge",
  "exercise_en": "Single Arm Kettlebell Bottoms Up Overhead Ipsilateral Lateral Lunge",
  "difficulty_level": "Avancé",
  "difficulty_level_en": "Advanced",
  "target_muscle_group": "Quadriceps",
  "target_muscle_group_en": "Quadriceps",
  "primary_equipment": "Kettlebell",
  "primary_equipment_en": "Kettlebell",
  "posture": "Debout",
  "posture_en": "Standing",
  "single_or_double_arm": "Un bras",
  "single_or_double_arm_en": "Single Arm",
  "continuous_or_alternating_arms": "Continu",
  "continuous_or_alternating_arms_en": "Continuous",
  "grip": "En bas",
  "grip_en": "Bottoms Up",
  "continuous_or_alternating_legs": "Continu",
  "continuous_or_alternating_legs_en": "Continuous",
  "foot_elevation": "Pas de surélévation",
  "foot_elevation_en": "No Elevation",
  "combination_exercises": "Exercice isolé",
  "combination_exercises_en": "Single Exercise",
  "movement_pattern": "Dominant du genou",
  "movement_pattern_en": "Knee Dominant",
  "body_region": "Bas du corps",
  "body_region_en": "Lower Body",
  "force_type": "Poussée",
  "force_type_en": "Push",
  "mechanics": "Exercice composé",
  "mechanics_en": "Compound",
  "laterality": "Ipsilatéral",
  "laterality_en": "Ipsilateral",
  "primary_exercise_classification": "Musculation",
  "primary_exercise_classification_en": "Bodybuilding",
  "text": "L'exercice \"Single Arm Kettlebell Bottoms Up Overhead Ipsilateral Lateral Lunge\" est une variante avancée qui sollicite intensément les quadriceps tout en intégrant un travail de stabilité et de coordination. Pour réaliser cet exercice, placez-vous debout avec un kettlebell dans une prise en bas, en tenant le poids d'une main. Le mouvement commence par une élévation du kettlebell au-dessus de votre tête, tout en maintenant un bras actif et continu. En parallèle, effectuez une fente latérale ipsilatérale, en déplaçant votre jambe du même côté que le bras qui tient le kettlebell. Ce mouvement se concentre sur le bas du corps avec un modèle de mouvement dominant du genou, tout en faisant appel à une mécanique d'exercice composé. Il s'agit d'un exercice isolé qui met l'accent sur la force de poussée, sans surélévation des pieds. Idéal pour les pratiquants de musculation, cet exercice renforce non seulement les jambes, mais améliore également votre équilibre et votre coordination."
}