{
  "exercise": "Single Arm Dumbbell Suitcase Hand Assisted Ipsilateral Foot Elevated Single Leg Calf Raise",
  "exercise_en": "Single Arm Dumbbell Suitcase Hand Assisted Ipsilateral Foot Elevated Single Leg Calf Raise",
  "difficulty_level": "Novice",
  "difficulty_level_en": "Novice",
  "target_muscle_group": "Mollets",
  "target_muscle_group_en": "Calves",
  "primary_equipment": "Haltère",
  "primary_equipment_en": "Dumbbell",
  "posture": "Debout sur une jambe",
  "posture_en": "Single Leg Standing",
  "single_or_double_arm": "Un bras",
  "single_or_double_arm_en": "Single Arm",
  "continuous_or_alternating_arms": "Continu",
  "continuous_or_alternating_arms_en": "Continuous",
  "grip": "Assistance manuelle",
  "grip_en": "Hand Assisted",
  "continuous_or_alternating_legs": "Continu",
  "continuous_or_alternating_legs_en": "Continuous",
  "foot_elevation": "Orteils surélevés",
  "foot_elevation_en": "Toes Elevated",
  "combination_exercises": "Exercice isolé",
  "combination_exercises_en": "Single Exercise",
  "movement_pattern": "Flexion plantaire de la cheville",
  "movement_pattern_en": "Ankle Plantar Flexion",
  "body_region": "Bas du corps",
  "body_region_en": "Lower Body",
  "force_type": "Poussée",
  "force_type_en": "Push",
  "mechanics": "Exercice d'isolation",
  "mechanics_en": "Isolation",
  "laterality": "Ipsilatéral",
  "laterality_en": "Ipsilateral",
  "primary_exercise_classification": "Musculation",
  "primary_exercise_classification_en": "Bodybuilding",
  "text": "L'exercice que nous allons aborder est le **Single Arm Dumbbell Suitcase Hand Assisted Ipsilateral Foot Elevated Single Leg Calf Raise**, idéal pour les novices souhaitant renforcer leurs mollets. Cet exercice se réalise debout sur une jambe, avec un haltère tenu dans une main, ce qui demande à la fois équilibre et concentration. Pendant l'exécution, un bras est en mouvement continu, tandis que l'autre main offre une assistance manuelle pour stabiliser le corps. Les orteils de la jambe surélevée reposent sur une surface élevée, permettant une flexion plantaire de la cheville, ce qui cible efficacement les muscles du bas du corps. Ce type d'exercice isolé favorise une poussée à partir de la jambe en action, tout en restant dans un modèle de mouvement ipsilatéral. En intégrant cette technique dans votre routine de musculation, vous pourrez développer la force et la définition de vos mollets de manière ciblée et contrôlée.",
  "antagonist_muscle_group": null,
  "secondary_muscle_groups": [],
  "exercise_family": "Isolation"
}